season,match_id,match_name,home_team,away_team,current_innings,innings_id,over,ball,runs,shortText,isBoundary,isWide,isNoball,batsman1_id,batsman1_name,batsman1_runs,batsman1_balls,bowler1_id,bowler1_name,bowler1_overs,bowler1_maidens,bowler1_runs,bowler1_wkts,wicket_id,wkt_batsman_name,wkt_bowler_name,wkt_batsman_runs,wkt_batsman_balls,wkt_text,isRetiredHurt,comm_cricinfo,comm_cricbuzz
2017,1082608,DC v KKR,DC,KKR,KKR,2,7,1,1,"Mishra to Pandey, 1 run",False,False,False,290630,Manish Pandey,9,10,31107,Amit Mishra,0.1,0,1,0,,,,,,,False,"sliding in on leg, clipped away to midwicket and they momentarily think of the second but Billings is on to the ball in a flash as he runs in from the deep","  6.1    Mishra to M Pandey, 1 run, begins with a slider on leg, knocked towards mid-wicket. Pandey wanted a single but Yusuf is not interested  "
2017,1082608,DC v KKR,DC,KKR,KKR,2,7,2,1,"Mishra to Pathan, 1 run",False,False,False,32498,Yusuf Pathan,22,12,31107,Amit Mishra,0.2,0,2,0,,,,,,,False,"flatter trajectory, pushed through fuller, Yusuf gets down and sweeps along the ground to backward square leg","  6.2    Mishra to Y Pathan, 1 run, lowers his centre of gravity and sweeps it away behind square  "
2017,1082608,DC v KKR,DC,KKR,KKR,2,7,3,0,"Mishra to Pandey, no run",False,False,False,290630,Manish Pandey,9,11,31107,Amit Mishra,0.3,0,2,0,,,,,,,False,"spinning away outside off from a length, comes forward and defends in front of the pad","  6.3    Mishra to M Pandey, no run, floaty leggie from Mishra, Pandey comes forward and offers a neat block  "
2017,1082608,DC v KKR,DC,KKR,KKR,2,7,4,0,"Mishra to Pandey, no run",False,False,False,290630,Manish Pandey,9,12,31107,Amit Mishra,0.4,0,2,0,,,,,,,False,sees some width and flays it hard but straight to the fielder at cover,"  6.4    Mishra to M Pandey, no run, touch quicker, Pandey punches it straight to extra cover  "
2017,1082608,DC v KKR,DC,KKR,KKR,2,7,5,1,"Mishra to Pandey, 1 run",False,False,False,290630,Manish Pandey,10,13,31107,Amit Mishra,0.5,0,3,0,,,,,,,False,"slightly short of a length, manages to get on top of the bounce and pull against the spin through midwicket and mid-on, Billings at the deep runs to his left and fields it","  6.5    Mishra to M Pandey, 1 run, pulls his length back, Pandey goes deep in his crease and swats it away to deep mid-wicket  "
2017,1082608,DC v KKR,DC,KKR,KKR,2,7,6,0,"Mishra to Pathan, no run",False,False,False,32498,Yusuf Pathan,22,13,31107,Amit Mishra,1.0,0,3,0,,,,,,,False,"full, on the pads, nudged away into the leg side","  6.6    Mishra to Y Pathan, no run, tossed up on the pads, Pathan crouches low and turns it gently to short mid-wicket  "
2017,1082608,DC v KKR,DC,KKR,KKR,2,8,1,2,"Mohammed Shami to Pandey, 2 runs",False,False,False,290630,Manish Pandey,12,14,481896,Mohammed Shami,0.1,0,2,0,,,,,,,False,"fullish length, turned away off the pads between mid-on and midwicket, mid-on runs across and picks it up","  7.1    Shami to M Pandey, 2 runs, curling in on middle, Pandey wrists it through mid-wicket, runs hard and gets a brace  "
2017,1082608,DC v KKR,DC,KKR,KKR,2,8,2,0,"Mohammed Shami to Pandey, no run",False,False,False,290630,Manish Pandey,12,15,481896,Mohammed Shami,0.2,0,2,0,,,,,,,False,backs away to make room to this length ball and carves it out to point,"  7.2    Shami to M Pandey, no run, takes a step forward looking to free his arms, doesn't quite get the width. Flashes it straight to point  "
2017,1082608,DC v KKR,DC,KKR,KKR,2,8,3,1,"Mohammed Shami to Pandey, 1 run",False,False,False,290630,Manish Pandey,13,16,481896,Mohammed Shami,0.3,0,3,0,,,,,,,False,"short of a length, angling in, whipped away to wide long-on for one","  7.3    Shami to M Pandey, 1 run, sensibly shaves it down to long-on  "
2017,1082608,DC v KKR,DC,KKR,KKR,2,8,4,0,"Mohammed Shami to Pathan, no run",False,False,False,32498,Yusuf Pathan,22,14,481896,Mohammed Shami,0.4,0,3,0,,,,,,,False,"short, outside off, Yusuf swivels around and pulls to square leg","  7.4    Shami to Y Pathan, no run, slower short ball from Shami, Pathan was early into the pull. Drags it straight to square leg  "
2017,1082608,DC v KKR,DC,KKR,KKR,2,8,5,0,"Mohammed Shami to Pathan, no run",False,False,False,32498,Yusuf Pathan,22,15,481896,Mohammed Shami,0.5,0,3,0,,,,,,,False,"full, outside off, driven hard off the front foot but straight to extra cover","  7.5    Shami to Y Pathan, no run, goes fuller outside off, Pathan drives it crisply but finds Zak at extra cover  "
2017,1082608,DC v KKR,DC,KKR,KKR,2,8,6,6,"Mohammed Shami to Pathan, SIX runs",True,False,False,32498,Yusuf Pathan,28,16,481896,Mohammed Shami,1.0,0,9,0,,,,,,,False,"that was almost one-handed. Full, outside off, that is just superb timing, no other way he could have got that kind of distance. Bottom hand comes off as he completes the shot, heaved away over cow corner","  7.6   Shami to Y Pathan, SIX, how on earth did it go over the ropes? Shami looks flabbergasted. Almost did in with this off-pace delivery, Pathan was months early into the shot, ends up mistiming it but such is his power that it went all the way for a maximum over deep mid-wicket. Pathan ended up hitting that with the use of one hand as the bottom hand came off "
2017,1082608,DC v KKR,DC,KKR,KKR,2,9,1,1,"Mishra to Pandey, 1 run",False,False,False,290630,Manish Pandey,14,17,31107,Amit Mishra,1.1,0,4,0,,,,,,,False,"short and spinning away, slapped hard off the backfoot to the right of sweeper cover","  8.1    Mishra to M Pandey, 1 run, cracks it away through cover  "
2017,1082608,DC v KKR,DC,KKR,KKR,2,9,2,1,"Mishra to Pathan, 1 run",False,False,False,32498,Yusuf Pathan,29,17,31107,Amit Mishra,1.2,0,5,0,,,,,,,False,"tossed up wide outside off, mistimes the drive to long-off","  8.2    Mishra to Y Pathan, 1 run, uses his feet, Mishra bowls it wide and Pathan protracts his hands and drills it to long-off  "
2017,1082608,DC v KKR,DC,KKR,KKR,2,9,3,6,"Mishra to Pandey, SIX runs",True,False,False,290630,Manish Pandey,20,18,31107,Amit Mishra,1.3,0,11,0,,,,,,,False,good use of the feet. Comes down the track and meets the pitch of the ball. Makes sure to give himself enough room before thumping it in the direction of the sigtscreen,"  8.3    Mishra to M Pandey, SIX, fabulous shot. Uses his feet, reaches the pitch and tonks one over long-on. Went sailing into the stands  "
2017,1082608,DC v KKR,DC,KKR,KKR,2,9,4,1,"Mishra to Pandey, 1 wide",False,True,False,290630,Manish Pandey,20,18,31107,Amit Mishra,1.3,0,12,0,,,,,,,False,tries to take it away from the batsman but fires it too wide outside off,"  8.4    Mishra to M Pandey, wide, pressure. Flights one well outside off, wided  "
2017,1082608,DC v KKR,DC,KKR,KKR,2,9,4,1,"Mishra to Pandey, 1 run",False,False,False,290630,Manish Pandey,21,19,31107,Amit Mishra,1.4,0,13,0,,,,,,,False,"short and wide, cut off the backfoot to sweeper cover","  8.4    Mishra to M Pandey, 1 run, flays this flatter ball through cover. 50-stand up  "
2017,1082608,DC v KKR,DC,KKR,KKR,2,9,5,0,"Mishra to Pathan, no run",False,False,False,32498,Yusuf Pathan,29,18,31107,Amit Mishra,1.5,0,13,0,,,,,,,False,gets down for a slog sweep and gets an inside edge to the pad,"  8.5    Mishra to Y Pathan, no run, ooh, Pathan winds up for a mighty slog, he only succeeds in finding an inside edge onto his pad  "
2017,1082608,DC v KKR,DC,KKR,KKR,2,9,6,4,"Mishra to Pathan, FOUR runs",True,False,False,32498,Yusuf Pathan,33,19,31107,Amit Mishra,2.0,0,17,0,,,,,,,False,what kind of a shot is that! That one's just brute force. Mishra drops it short again and there is room on offer outside off. Pathan opens up his arms and just flat-bats it. Shovels it straight down the ground,"  8.6    Mishra to Y Pathan, FOUR, didn't get it where he intended but still earns himself a boundary. Mishra drops it shorter again, Pathan went for a muscular blow across the line, the ball takes the top-half of the blade and loops over Mishra's head. Races away to the fence  "
2017,1082608,DC v KKR,DC,KKR,KKR,2,10,1,1,"Mohammed Shami to Pandey, 1 run",False,False,False,290630,Manish Pandey,22,20,481896,Mohammed Shami,1.1,0,10,0,,,,,,,False,"short of a length, angling in to the body, gets cramped for room as he looks to punch and gets an inside edge to backward square leg","  9.1    Shami to M Pandey, 1 run, goes wide of the crease and nips one into Pandey, who squirts an inside edge that trickles towards the keeper  "
2017,1082608,DC v KKR,DC,KKR,KKR,2,10,2,1,"Mohammed Shami to Pathan, 1 run",False,False,False,32498,Yusuf Pathan,34,20,481896,Mohammed Shami,1.2,0,11,0,,,,,,,False,"short of a length, at 123 kph, Pathan is through with the pull a tad early and the ball does not bounce as much as he would have liked. Gets it away off the bottom part of the bat","  9.2    Shami to Y Pathan, 1 run, deceives Pathan with this slower short ball. Messes up his timing and skews it off the inside edge onto his thigh  "
2017,1082608,DC v KKR,DC,KKR,KKR,2,10,3,1,"Mohammed Shami to Pandey, 1 run",False,False,False,290630,Manish Pandey,23,21,481896,Mohammed Shami,1.3,0,12,0,,,,,,,False,"short and wide outside off, punched away square of the wicket for a single","  9.3    Shami to M Pandey, 1 run, goes wider of off, slashed away to sweeper cover  "
2017,1082608,DC v KKR,DC,KKR,KKR,2,10,4,1,"Mohammed Shami to Pathan, 1 run",False,False,False,32498,Yusuf Pathan,35,21,481896,Mohammed Shami,1.4,0,13,0,,,,,,,False,"back of a length, outside off, cut away to the left of sweeper for a single","  9.4    Shami to Y Pathan, 1 run, rolls his fingers across this back of a length delivery outside off, Pathan meekly pushes it through cover  "
2017,1082608,DC v KKR,DC,KKR,KKR,2,10,5,5,"Mohammed Shami to Pandey, 5 wides",False,True,False,290630,Manish Pandey,23,21,481896,Mohammed Shami,1.4,0,18,0,,,,,,,False,"misses the batsman's pad as well as the keeper diving to his left. Sliding on leg and Pandey tries to glance it away, gets the pad outside the line of the ball and it sneaks away just outside leg. Keeper fails to stop it as well","  9.5    Shami to M Pandey, 5 wides, bonus runs for KKR. Shami spills one down leg, Pandey yanks his leg out of the way. Pant dives to his left but in vain  "
2017,1082608,DC v KKR,DC,KKR,KKR,2,10,5,0,"Mohammed Shami to Pandey, no run",False,False,False,290630,Manish Pandey,23,22,481896,Mohammed Shami,1.5,0,18,0,,,,,,,False,"full, outside off, knocks it hard back towards the bowler","  9.5    Shami to M Pandey, no run, fullish outside off, Pandey drills it hard, Shami prances low and stops it in his followthrough  "
2017,1082608,DC v KKR,DC,KKR,KKR,2,10,6,4,"Mohammed Shami to Pandey, FOUR runs",True,False,False,290630,Manish Pandey,27,23,481896,Mohammed Shami,2.0,0,22,0,,,,,,,False,"was that deliberate? Seems like. Short of good length but not much room on offer. Pandey hangs back and opens the face of his half-angled bat very late, gets an outside edge that goes past Pant diving full-length to his right and away to the third man boundary she goes","  9.6    Shami to M Pandey, FOUR, this is intentional stuff from Pandey. Waits in his crease till the last instant, opens the bat face and runs it through the vacant slip region  "
2017,1082608,DC v KKR,DC,KKR,KKR,2,11,1,1,"Mathews to Pathan, 1 leg bye",False,False,False,32498,Yusuf Pathan,35,22,49764,Angelo Mathews,0.1,0,0,0,,,,,,,False,"good shout for leg before. Not given. Short of a length, angling in, misses the bat as he is looking to tuck it away. Hit in front of leg, it seemed like. But the angle could have been taking it down the leg side","  10.1    Mathews to Y Pathan, leg byes, 1 run, starts with a typical off-pace delivery. Pathan shuffles across and misses the angling in length ball. The impact was on leg. Probably going down leg. A leg-bye nabbed. Vociferous appeal from the bowler and the keeper, the umpire wasn't interested  "
2017,1082608,DC v KKR,DC,KKR,KKR,2,11,2,1,"Mathews to Pandey, 1 run",False,False,False,290630,Manish Pandey,28,24,49764,Angelo Mathews,0.2,0,1,0,,,,,,,False,"full, on middle and leg, pushes it down to long-on and jogs the single","  10.2    Mathews to M Pandey, 1 run, pitches it up this time, just a tap down to long-on. Pandey is content with a single  "
2017,1082608,DC v KKR,DC,KKR,KKR,2,11,3,1,"Mathews to Pathan, 1 run",False,False,False,32498,Yusuf Pathan,36,23,49764,Angelo Mathews,0.3,0,2,0,,,,,,,False,"short, sitting up nicely, pulled out to deep midwicket, straight to the fielder there","  10.3    Mathews to Y Pathan, 1 run, short ball at 127kph aimed at the body, Pathan pulls it straight to deep mid-wicket  "
2017,1082608,DC v KKR,DC,KKR,KKR,2,11,4,1,"Mathews to Pandey, 1 run",False,False,False,290630,Manish Pandey,29,25,49764,Angelo Mathews,0.4,0,3,0,,,,,,,False,"short of a length, angling in, drops it into the leg side and picks a single through square leg","  10.4    Mathews to M Pandey, 1 run, short of length delivery on middle and leg, Pandey walks across and nudges it to deep mid-wicket. Just a single  "
2017,1082608,DC v KKR,DC,KKR,KKR,2,11,5,0,"Mathews to Pathan, no run",False,False,False,32498,Yusuf Pathan,36,24,49764,Angelo Mathews,0.5,0,3,0,,,,,,,False,"sliding down the leg side, tries to glance it but misses and the ball kisses the pad on its way to the left of the wicketkeeper","  10.5    Mathews to Y Pathan, no run, drifting down leg, Pathan fails to lay bat on ball. The ball brushes his pad and settles into the gloves of Pant  "
2017,1082608,DC v KKR,DC,KKR,KKR,2,11,6,1,"Mathews to Pathan, 1 run",False,False,False,32498,Yusuf Pathan,37,25,49764,Angelo Mathews,1.0,0,4,0,,,,,,,False,"on a length, not much pace from Mathews, so all he can do is whip it away uppishly wide of the mid-on region","  10.6    Mathews to Y Pathan, 1 run, just five runs off the over. Superb stuff from Mathews. He isn't offering any pace for the batsmen to work with. Short of a good length, Pathan wrists it to mid-wicket  "
2017,1082608,DC v KKR,DC,KKR,KKR,2,12,1,1,"Mohammed Shami to Pathan, 1 run",False,False,False,32498,Yusuf Pathan,38,26,481896,Mohammed Shami,2.1,0,23,0,,,,,,,False,"shortish, pulled wide of mid-on. There is a fielder in place at long-on and he gets across to his right and fields it","  11.1    Shami to Y Pathan, 1 run, shortish ball, mistimes pull through mid-wicket  "
2017,1082608,DC v KKR,DC,KKR,KKR,2,12,2,1,"Mohammed Shami to Pandey, 1 run",False,False,False,290630,Manish Pandey,30,26,481896,Mohammed Shami,2.2,0,24,0,,,,,,,False,"full, just outside off, backs away and stabs it out with an open face of the bat through cover-point","  11.2    Shami to M Pandey, 1 run, fuller wide of off, Pandey moves leg-side and directs it to deep point by opening his bat face  "
2017,1082608,DC v KKR,DC,KKR,KKR,2,12,3,1,"Mohammed Shami to Pathan, 1 run",False,False,False,32498,Yusuf Pathan,39,27,481896,Mohammed Shami,2.3,0,25,0,,,,,,,False,"fullish, outside off again, fetches it from outside off and thumps it hard in the direction  of long-on where the ball goes one-bounce to the fielder","  11.3    Shami to Y Pathan, 1 run, short of length delivery outside off, Pathan stands tall and lofts down the ground. One bounce and into the hands of the long-on fielder  "
2017,1082608,DC v KKR,DC,KKR,KKR,2,12,4,1,"Mohammed Shami to Pandey, 1 run",False,False,False,290630,Manish Pandey,31,27,481896,Mohammed Shami,2.4,0,26,0,,,,,,,False,"full and wide, hangs back and opens the face of his bat to get it squarer of the third man fielder for one","  11.4    Shami to M Pandey, 1 run, uses the width outside off and steers it down to third man  "
2017,1082608,DC v KKR,DC,KKR,KKR,2,12,5,1,"Mohammed Shami to Pathan, 1 wide",False,True,False,32498,Yusuf Pathan,39,27,481896,Mohammed Shami,2.4,0,27,0,,,,,,,False,"slower short ball, flirting with the line outside off and called a wide. Seems like the right call in the end","  11.5    Shami to Y Pathan, wide, slower bumper outside off. Pathan lets it go. It was outside the tramline. Pant wasn't impressed with the call. That was wide  "
2017,1082608,DC v KKR,DC,KKR,KKR,2,12,5,1,"Mohammed Shami to Pathan, 1 run",False,False,False,32498,Yusuf Pathan,40,28,481896,Mohammed Shami,2.5,0,28,0,,,,,,,False,rolls his fingers over this shortish ball and Pathan does not find good timing on the pull to deep midwicket,"  11.5    Shami to Y Pathan, 1 run, Pathan is struggling with his timing. Another miscued pull against this short delivery. Straight to deep mid-wicket  "
2017,1082608,DC v KKR,DC,KKR,KKR,2,12,6,0,"Mohammed Shami to Pandey, no run",False,False,False,290630,Manish Pandey,31,28,481896,Mohammed Shami,3.0,0,28,0,,,,,,,False,on the pads and turned away to short fine leg. Manish Pandey sets off for a single but Yusuf has a fair idea of where that went and yells out a no. Pandey has to hurry back and a direct throw could have made things interesting,"  11.6    Shami to M Pandey, no run, angling in delivery, Pandey is cramped for room and he inside-edges it to short fine. Mathews is quick to fire in the throw at the striker's end. Pandey would have made it anyway. He was wisely sent back by his partner  "
2017,1082608,DC v KKR,DC,KKR,KKR,2,13,1,1,"Mathews to Pathan, 1 run",False,False,False,32498,Yusuf Pathan,41,29,49764,Angelo Mathews,1.1,0,5,0,,,,,,,False,"full, on the pads, whipped away off them to deep backward square leg for one","  12.1    Mathews to Y Pathan, 1 run, fuller length delivery drifting onto the pads, flicked away to long leg  "
2017,1082608,DC v KKR,DC,KKR,KKR,2,13,2,6,"Mathews to Pandey, SIX runs",True,False,False,290630,Manish Pandey,37,29,49764,Angelo Mathews,1.2,0,11,0,,,,,,,False,moves away outside leg stump early to give himself the room to free his arms. The bowler tries to follow him by angling it in but Pandey still finds the room he was looking for. Whip[s it uppishly off the pads and uses his wrists well to cart it over deep midwicket,"  12.2    Mathews to M Pandey, SIX, that's a pressure-releaser. Jogs down the track and uses his wrists to good effect. Flicks it handsomely over square leg. there were two men in the deep. All they could do was watch it sail over the rope  "
2017,1082608,DC v KKR,DC,KKR,KKR,2,13,3,1,"Mathews to Pandey, 1 run",False,False,False,290630,Manish Pandey,38,30,49764,Angelo Mathews,1.3,0,12,0,,,,,,,False,"full and on the pads, clipped hard to wide long-on for one","  12.3    Mathews to M Pandey, 1 run, Pant is up to the stumps and Mathews darts in a fullish ball. A wristy on-drive to long-on  "
2017,1082608,DC v KKR,DC,KKR,KKR,2,13,4,0,"Mathews to Pathan, no run",False,False,False,32498,Yusuf Pathan,41,30,49764,Angelo Mathews,1.4,0,12,0,,,,,,,False,"slower short ball, just 106 kph, tries to pull but gets the timing all wrong. This time Pant was not standing up to the stumps and the ball drops into the surface after it takes the glove of Pathan","  12.4    Mathews to Y Pathan, no run, ah! Had Pant been up this time, he might have caught it. Pathan is completely undone by this slower short ball. Pathan is early into his shot - the pull. The ball ballooned up off his glove and fell well in front of the keeper  "
2017,1082608,DC v KKR,DC,KKR,KKR,2,13,5,2,"Mathews to Pathan, 2 runs",False,False,False,32498,Yusuf Pathan,43,31,49764,Angelo Mathews,1.5,0,14,0,,,,,,,False,sees him come down the track and the bowler fires it on the pad. The ball misses the flicks and goes off the pad to midwicket. They come charging back for the second. No direct hit at the non-striker's end and even a direct hit may still not have been good enough. Good running,"  12.5    Mathews to Y Pathan, 2 runs, skips down and gets an inside edge onto the pad. The ball rolls slowly towards Billings at deep mid-wicket. Good running ensures a couple  "
2017,1082608,DC v KKR,DC,KKR,KKR,2,13,6,1,"Mathews to Pathan, 1 run",False,False,False,32498,Yusuf Pathan,44,32,49764,Angelo Mathews,2.0,0,15,0,,,,,,,False,"full and on the pads, clipped off them uppishly in the direction of deep midwicket, lands on the bounce in front of Billings who is guarding the boundary there","  12.6    Mathews to Y Pathan, 1 run, fuller length delivery on middle and leg, Pathan flicks it uppishly. On the bounce to deep mid-wicket  "
2017,1082608,DC v KKR,DC,KKR,KKR,2,14,1,1,"Khan to Pathan, 1 run",False,False,False,32498,Yusuf Pathan,45,33,30102,Zaheer Khan,3.1,0,14,2,,,,,,,False,"goes for a yorker outside off and ends up firing a full toss around knee height, punched down to long-off","  13.1    Zaheer to Y Pathan, 1 run, starts with a low, dipping full toss outside off, Pathan goes hard on his drive. Just a single to long-off  "
2017,1082608,DC v KKR,DC,KKR,KKR,2,14,2,0,"Khan to Pandey, no run",False,False,False,290630,Manish Pandey,38,31,30102,Zaheer Khan,3.2,0,14,2,,,,,,,False,"another full toss, he is late in closing the face of the bat and it is pushed back to the bowler","  13.2    Zaheer to M Pandey, no run, another low full toss. Pandey, in an attempt to whip it through the on-side, closes his bat face a bit too early. The leading edge falls short of Zaheer  "
2017,1082608,DC v KKR,DC,KKR,KKR,2,14,3,1,"Khan to Pandey, 1 run",False,False,False,290630,Manish Pandey,39,32,30102,Zaheer Khan,3.3,0,15,2,,,,,,,False,"full and wide, that is what he was looking for, squeezed down to long-off","  13.3    Zaheer to M Pandey, 1 run, full and just outside off, Pandey moves slightly leg-side and squeezes the drive down to long-off  "
2017,1082608,DC v KKR,DC,KKR,KKR,2,14,4,6,"Khan to Pathan, SIX runs",True,False,False,32498,Yusuf Pathan,51,34,30102,Zaheer Khan,3.4,0,21,2,,,,,,,False,"gets the attempted wide yorker wrong again. Low full toss, outside off, Pathan responds with a full swing of the arms and deposits it over cow corner. <b>Fifty for Pathan</b>","  13.4    Zaheer to Y Pathan, SIX, can't get away with this full toss! Pathan brings up his fifty in style. He clears his front leg and swings his bat hard. Finds the gap between long-on and deep mid-wicket and has enough power to go all the way as well  "
2017,1082608,DC v KKR,DC,KKR,KKR,2,14,5,3,"Khan to Pathan, 3 runs",False,False,False,32498,Yusuf Pathan,54,35,30102,Zaheer Khan,3.5,0,24,2,,,,,,,False,"low full toss again and this time it has been lofted straight down the ground. Long-off darts across to his right, slides in and throws the ball to the other fielder converging on it. Superb effort from Morris at the boundary, gets down and tidily cuts it off right in front of the boundary. They go upstairs to check if he has brushed the rope but he seems to have done fine there. They come charging back for the third and manage to beat the throw","  13.5    Zaheer to Y Pathan, 3 runs, 100-run stand between the duo. Another low full toss, Pathan gets underneath the delivery and drills it down the ground. Morris from long-off dives full length to his right and flicks the ball back in play. The other fielder (Nair) from long-on fires in a throw, but he can't stop the duo from taking the third. Excellent running  "
2017,1082608,DC v KKR,DC,KKR,KKR,2,14,6,4,"Khan to Pandey, FOUR runs",True,False,False,290630,Manish Pandey,43,33,30102,Zaheer Khan,4.0,0,28,2,,,,,,,False,"full, on the pads, misses the flick and goes off the pad past the keeper diving to his left. Four through deep fine leg. After a great first spell, Zaheer has slightly lost it here","  13.6   Zaheer to M Pandey, FOUR, 15 off the over and Zaheer isn't happy. Probably with himself. After serving all those full tosses, he drifts one down leg. Pandey moves across and gets a faint tickle. No chance for Pant who put in a desperate dive. The ball dribbles away into the fence "
2017,1082608,DC v KKR,DC,KKR,KKR,2,15,1,1,"Morris to Pathan, 1 run",False,False,False,32498,Yusuf Pathan,55,36,439952,Chris Morris,1.1,0,8,0,,,,,,,False,"full, on middle and leg, clipped off the toes down to long-on for a single","  14.1    Chris Morris to Y Pathan, 1 run, full, pacy and on the stumps, driven down to long-on  "
2017,1082608,DC v KKR,DC,KKR,KKR,2,15,2,1,"Morris to Pandey, 1 run",False,False,False,290630,Manish Pandey,44,34,439952,Chris Morris,1.2,0,9,0,,,,,,,False,"full, around off, backs away and carves it out to cover","  14.2    Chris Morris to M Pandey, 1 run, on the stumps again, Pandey backs away and middles the push to extra cover. A single taken  "
2017,1082608,DC v KKR,DC,KKR,KKR,2,15,3,0,"Morris to Pathan, no run",False,False,False,32498,Yusuf Pathan,55,37,439952,Chris Morris,1.3,0,9,0,,,,,,,False,"swing and a miss outside off. Fullish and outside off, tries to heave it away across the line and over the leg side. Makes no contact","  14.3    Chris Morris to Y Pathan, no run, ah! A wild swing across the line from Pathan against this fullish ball. Misses it completely  "
2017,1082608,DC v KKR,DC,KKR,KKR,2,15,4,4,"Morris to Pathan, FOUR runs",True,False,False,32498,Yusuf Pathan,59,38,439952,Chris Morris,1.4,0,13,0,,,,,,,False,"full toss, angling into him, Yusuf does not miss out on those. Flicked off the pads to deep fine leg, helps it on its way","  14.4    Chris Morris to Y Pathan, FOUR, this is a gift and Pathan collects it with both hands. Full toss down leg, Pathan gets enough wood on his wild bat-swing and gets it very fine  "
