season,match_id,match_name,home_team,away_team,current_innings,innings_id,over,ball,runs,shortText,isBoundary,isWide,isNoball,batsman1_id,batsman1_name,batsman1_runs,batsman1_balls,bowler1_id,bowler1_name,bowler1_overs,bowler1_maidens,bowler1_runs,bowler1_wkts,wicket_id,wkt_batsman_name,wkt_bowler_name,wkt_batsman_runs,wkt_batsman_balls,wkt_text,isRetiredHurt,comm_cricinfo,comm_cricbuzz
2017,1082627,SRH v KKR,SRH,KKR,KKR,2,7,3,0,"Rashid Khan to Uthappa, no run",False,False,False,35582,Robin Uthappa,21,13,793463,Rashid Khan,0.3,0,6,0,,,,,,,False,"tries to nudge it late this time with the turn, misses again","  6.3    Rashid Khan to Uthappa, no run, and now tries to run it down to third man but is beaten by the turn  "
2017,1082627,SRH v KKR,SRH,KKR,KKR,2,7,4,1,"Rashid Khan to Uthappa, 1 run",False,False,False,35582,Robin Uthappa,22,14,793463,Rashid Khan,0.4,0,7,0,,,,,,,False,"pretty full and drifting in towards leg, driven down to long on","  6.4    Rashid Khan to Uthappa, 1 run, Rashid Khan throws it too full. Uthappa eases down to long-on  "
2017,1082627,SRH v KKR,SRH,KKR,KKR,2,7,5,0,"Rashid Khan to Pandey, no run",False,False,False,290630,Manish Pandey,17,12,793463,Rashid Khan,0.5,0,7,0,,,,,,,False,"plays for the turn, tries to work it to off but it zips past him","  6.5    Rashid Khan to M Pandey, no run, and again. Now Pandey wants to play it late and work towards third man, is beaten  "
2017,1082627,SRH v KKR,SRH,KKR,KKR,2,7,6,1,"Rashid Khan to Pandey, 1 run",False,False,False,290630,Manish Pandey,18,13,793463,Rashid Khan,1.0,0,8,0,,,,,,,False,"angling in a little bit more, he works it to leg for one","  6.6    Rashid Khan to M Pandey, 1 run, stays back to this flatter ball and works in the vacant spaces at mid-wicket to bring a single and covers  "
2017,1082627,SRH v KKR,SRH,KKR,KKR,2,8,1,1,"Henriques to Pandey, 1 run",False,False,False,290630,Manish Pandey,19,14,5961,Moises Henriques,1.1,0,9,0,,,,,,,False,"length delivery at 115kph outside off, Pandey makes room and bottom edged it to mid on","  7.1    Henriques to M Pandey, 1 run, backs away to this slower ball on off and swipes off the inside half of the willow to mid-on  "
2017,1082627,SRH v KKR,SRH,KKR,KKR,2,8,2,1,"Henriques to Uthappa, 1 run",False,False,False,35582,Robin Uthappa,23,15,5961,Moises Henriques,1.2,0,10,0,,,,,,,False,"slow offcutter off 115kph outside off, Uthappa leans into it, defends with soft hands and gets a single. the throw at non-striker's end hits Uthappa and deflects to long-off","  7.2    Henriques to Uthappa, 1 run, prods forward and across before tapping to Yuvi at backward point. The fielder has a shy at the bowler's end and he hits the bat of Uthappa. Might have been interesting had the bat not come in the way  "
2017,1082627,SRH v KKR,SRH,KKR,KKR,2,8,3,1,"Henriques to Pandey, 1 run",False,False,False,290630,Manish Pandey,20,15,5961,Moises Henriques,1.3,0,11,0,,,,,,,False,"he opens up to swing, and pulls the short of length ball to deep midwicket","  7.3    Henriques to M Pandey, 1 run, another off-pace delivery that exposes a room-making Pandey, swiped across the line to deep square leg for a single  "
2017,1082627,SRH v KKR,SRH,KKR,KKR,2,8,4,1,"Henriques to Uthappa, 1 run",False,False,False,35582,Robin Uthappa,24,16,5961,Moises Henriques,1.4,0,12,0,,,,,,,False,"129kph, works the ball angling into him to the leg side","  7.4    Henriques to Uthappa, 1 run, short of a good length and veering in a bit off the deck, tucked off the back foot to mid-wicket  "
2017,1082627,SRH v KKR,SRH,KKR,KKR,2,8,5,1,"Henriques to Pandey, 1 run",False,False,False,290630,Manish Pandey,21,16,5961,Moises Henriques,1.5,0,13,0,,,,,,,False,rolls his wrists over that length ball to help it to long on,"  7.5    Henriques to M Pandey, 1 run, Pandey refrains from backing away this time and pushes this length ball down the ground  "
2017,1082627,SRH v KKR,SRH,KKR,KKR,2,8,6,1,"Henriques to Uthappa, 1 run",False,False,False,35582,Robin Uthappa,25,17,5961,Moises Henriques,2.0,0,14,0,,,,,,,False,"Yuvraj tries the direct hit at keeper's end, misses! He hits the batsman's bat instead. It was just outside off, Uthappa defended with soft hands for a quick single and took off, but Yuvraj could not get the stumps","  7.6    Henriques to Uthappa, 1 run, once again Yuvi misses the direct hit, this time at the striker's end. Uthappa had opened his bat-face at the last moment to tap it in front of the former at the backward point. Took his chance and went for the single. It was his partner running at the danger and fortunately for him the throw did not hit the target  "
2017,1082627,SRH v KKR,SRH,KKR,KKR,2,9,1,6,"Rashid Khan to Uthappa, SIX runs",True,False,False,35582,Robin Uthappa,31,18,793463,Rashid Khan,1.1,0,14,0,,,,,,,False,"another first ball from Rashid is dispatched to leg for six from Uthappa! This one was much bigger and he lofted it against the turn over wide long on. Not as big, but big enough","  8.1    Rashid Khan to Uthappa, SIX, this is the second time Uthappa has slogged across the line off Rashid Khan. And like the previous occasion makes good connection again, sending it deep into the stands at deep mid-wicket  "
2017,1082627,SRH v KKR,SRH,KKR,KKR,2,9,2,4,"Rashid Khan to Uthappa, FOUR runs",True,False,False,35582,Robin Uthappa,35,19,793463,Rashid Khan,1.2,0,18,0,,,,,,,False,"bit too short, maybe Uthappa expected that and he went back in the crease to slap-pull that to the umpire's right for a powerful four","  8.2    Rashid Khan to Uthappa, FOUR, the previous shot forces Rashid Khan to pitch it short and Uthappa makes merry. Goes back and pulls it straight down the ground  "
2017,1082627,SRH v KKR,SRH,KKR,KKR,2,9,3,1,"Rashid Khan to Uthappa, 1 run",False,False,False,35582,Robin Uthappa,36,20,793463,Rashid Khan,1.3,0,19,0,,,,,,,False,pretty full now and it's drilled down to long off,"  8.3    Rashid Khan to Uthappa, 1 run, uses his feet a touch to this tossed up delivery and drills it hard down the ground to long-off  "
2017,1082627,SRH v KKR,SRH,KKR,KKR,2,9,4,2,"Rashid Khan to Pandey, 2 runs",False,False,False,290630,Manish Pandey,23,17,793463,Rashid Khan,1.4,0,21,0,,,,,,,False,"the flatter delivery on off stump, he goes back and nudges to leg to come back for the second","  8.4    Rashid Khan to M Pandey, 2 runs, skidder that gets negotiated well. Pandey goes back in the crease and tucks in front of square leg, milks a couple  "
2017,1082627,SRH v KKR,SRH,KKR,KKR,2,9,5,0,"Rashid Khan to Pandey, no run",False,False,False,290630,Manish Pandey,23,18,793463,Rashid Khan,1.5,0,21,0,,,,,,,False,"some turn there outside off, maybe the batsman didn't expect it so outside off and he left it","  8.5    Rashid Khan to M Pandey, no run, turns away outside off. Pandey watches it closely and lets it go at the last instant  "
2017,1082627,SRH v KKR,SRH,KKR,KKR,2,9,6,1,"Rashid Khan to Pandey, 1 run",False,False,False,290630,Manish Pandey,24,19,793463,Rashid Khan,2.0,0,22,0,,,,,,,False,"closer to the stumps now, defends it late towards point for another quick single","  8.6    Rashid Khan to M Pandey, 1 run, Pandey does not commit much once again and is happy to wait behind. Pandey taps to short third man for a quick single  "
2017,1082627,SRH v KKR,SRH,KKR,KKR,2,10,1,2,"Bipul Sharma to Pandey, 2 runs",False,False,False,290630,Manish Pandey,26,20,35928,Bipul Sharma,0.1,0,2,0,,,,,,,False,charges down first ball and slogs it in the gap between long on and deep midwicket for two,"  9.1    Bipul Sharma to M Pandey, 2 runs, skips down and tries to go too hard, messing the timing a bit. Warner, from long-on, runs to his right and saves two  "
2017,1082627,SRH v KKR,SRH,KKR,KKR,2,10,2,1,"Bipul Sharma to Pandey, 1 wide",False,True,False,290630,Manish Pandey,26,20,35928,Bipul Sharma,0.1,0,3,0,,,,,,,False,slow and flat down leg for a wide,"  9.2    Bipul Sharma to M Pandey, wide, sliding down. Polite enquiry from the keeper as Pandey misses the paddle. Given as wide  "
2017,1082627,SRH v KKR,SRH,KKR,KKR,2,10,2,2,"Bipul Sharma to Pandey, 2 runs",False,False,False,290630,Manish Pandey,28,21,35928,Bipul Sharma,0.2,0,5,0,,,,,,,False,"bit more flight on the off stump, he goes back to nudge it to midwicket because the fielder is deep and they get two. Ojha chased it and sent back a throw towards the middle of the pitch","  9.2    Bipul Sharma to M Pandey, 2 runs, 'bowling end,' shouted Sharma but the fielder did not pay much heed. Or did he? The throw was wayward anyway. Pandey had gone back to tuck in front of square leg to steal two  "
2017,1082627,SRH v KKR,SRH,KKR,KKR,2,10,3,1,"Bipul Sharma to Pandey, 1 run",False,False,False,290630,Manish Pandey,29,22,35928,Bipul Sharma,0.3,0,6,0,,,,,,,False,"comes down again, but there's not pace on the ball and he chips it towards deep midwicket","  9.3    Bipul Sharma to M Pandey, 1 run, swings after stepping down, has not got the timing right. Drags wide of deep square leg for a single  "
2017,1082627,SRH v KKR,SRH,KKR,KKR,2,10,4,1,"Bipul Sharma to Uthappa, 1 run",False,False,False,35582,Robin Uthappa,37,21,35928,Bipul Sharma,0.4,0,7,0,,,,,,,False,"slow at 82kph towards the pads, he makes some room and swings it to deep midwicket","  9.4    Bipul Sharma to Uthappa, 1 run, half-pull, half-whip from Uthappa on this shortish ball. Will pick up a single to deep square leg  "
2017,1082627,SRH v KKR,SRH,KKR,KKR,2,10,5,2,"Bipul Sharma to Pandey, 2 runs",False,False,False,290630,Manish Pandey,31,23,35928,Bipul Sharma,0.5,0,9,0,,,,,,,False,"bit too wide outside off, Pandey goes on the back foot and cuts it nicely to deep backward point for two","  9.5    Bipul Sharma to M Pandey, 2 runs, bit flat outside off and Pandey goes deep to cut past backward point for a couple. Sweeper did the mopping work there  "
2017,1082627,SRH v KKR,SRH,KKR,KKR,2,10,6,1,"Bipul Sharma to Pandey, 1 run",False,False,False,290630,Manish Pandey,32,24,35928,Bipul Sharma,1.0,0,10,0,,,,,,,False,"towards the leg side again, <strong>leading edge</strong> goes towards midwicket but there's no fielder there. Dhawan runs in from the deep to keep it to one","  9.6    Bipul Sharma to M Pandey, 1 run, uses the depth of the crease and chips in the air but it is in the gap at backward square leg. They take one in the meantime  "
2017,1082627,SRH v KKR,SRH,KKR,KKR,2,11,1,2,"Kumar to Pandey, 2 runs",False,False,False,290630,Manish Pandey,34,25,326016,Bhuvneshwar Kumar,1.1,0,11,0,,,,,,,False,"starts with a fullish delivery, Pandey slams it to the leg side, wide of long on for two","  10.1    Bhuvneshwar to M Pandey, 2 runs, the full ball stops on him slightly, so he takes his front leg out and wrists the ball through wide mid-on. Comes back for the second, easily  "
2017,1082627,SRH v KKR,SRH,KKR,KKR,2,11,2,1,"Kumar to Pandey, 1 run",False,False,False,290630,Manish Pandey,35,26,326016,Bhuvneshwar Kumar,1.2,0,12,0,,,,,,,False,"short and wide, Pandey dances down and slams it to deep point","  10.2    Bhuvneshwar to M Pandey, 1 run, sees him making room and drops it wide, only for Pandey to reach out, inclining on his toes and cutting it through point  "
2017,1082627,SRH v KKR,SRH,KKR,KKR,2,11,3,1,"Kumar to Uthappa, 1 run",False,False,False,35582,Robin Uthappa,38,22,326016,Bhuvneshwar Kumar,1.3,0,13,0,,,,,,,False,"goes across outside off and tries to sweep-scoop, but only gets an inside edge onto his pad and they take a single. Siraj does well to get a direct hit at bowler's end but Uthappa was in","  10.3    Bhuvneshwar to Uthappa, 1 run, too early to shuffle across and look to sweep. Bhuvi has a full ball to foil it, and raps the pad, I suppose. Just a tickle then off the bat, and there's one run round the corner  "
2017,1082627,SRH v KKR,SRH,KKR,KKR,2,11,4,2,"Kumar to Pandey, 2 runs",False,False,False,290630,Manish Pandey,37,27,326016,Bhuvneshwar Kumar,1.4,0,15,0,,,,,,,False,"slightly short and wide again, he lofts it over the covers in the gap for two more. Doubles serving the purpose till now","  10.4    Bhuvneshwar to M Pandey, 2 runs, another deliberate wide one. Pandey wants width, Kumar gives him plenty. So much so that Pandey has to reach out and slice it over cover-point  "
2017,1082627,SRH v KKR,SRH,KKR,KKR,2,11,5,2,"Kumar to Pandey, 2 runs",False,False,False,290630,Manish Pandey,39,28,326016,Bhuvneshwar Kumar,1.5,0,17,0,,,,,,,False,pivots on the back foot and slaps the ball to the left of deep midwicket. It's in the gap for two more,"  10.5    Bhuvneshwar to M Pandey, 2 runs, just back of a length, Pandey hacks it for two runs through mid-wicket  "
2017,1082627,SRH v KKR,SRH,KKR,KKR,2,11,6,0,"Kumar to Pandey, OUT",False,False,False,290630,Manish Pandey,39,29,326016,Bhuvneshwar Kumar,2.0,0,17,1,290630.0,Manish Pandey,Bhuvneshwar Kumar,39.0,29.0,MK Pandey c &amp; b Kumar 39 (40m 29b 3x4 0x6) SR: 134.48,False,"a bit of a <strong>juggle</strong> and Bhuvneshwar takes a return catch! It was slightly slower, Pandey had gone across to work it to leg but the ball was outside off on length and his bat ended up straight to pop the catch back to Bhuvi. It went straight to him around shoulder height but bounced off the hands before he caught it again","  10.6    Bhuvneshwar to M Pandey, out Caught&Bowled!! How good is Bhuvneshwar? Pandey was walking into a chip-drive through mid-on say, Kumar bowls a cutter and has Pandey prodding at the ball way too early. Result: a chip back down to Bhuvneshwar, who tips it up in the air off his fingertips and then holds onto the rebound like a man who knows what he's doing. M Pandey c and b Bhuvneshwar 39(29) [4s-3]  "
2017,1082627,SRH v KKR,SRH,KKR,KKR,2,12,1,6,"Henriques to Uthappa, SIX runs",True,False,False,35582,Robin Uthappa,44,23,5961,Moises Henriques,2.1,0,20,0,,,,,,,False,"that's one way to take the pressure off! Makes room against a cutter, it was short of length and he absolutely hammered that over deep midwicket, his favourite area today","  11.1    Henriques to Uthappa, SIX, goodness gracious. Spots the bowler rolling his fingers across and delays his slog over mid-wicket, bruting the ball way over for a maximum  "
2017,1082627,SRH v KKR,SRH,KKR,KKR,2,12,2,1,"Henriques to Uthappa, 1 run",False,False,False,35582,Robin Uthappa,45,24,5961,Moises Henriques,2.2,0,21,0,,,,,,,False,"another slower delivery, he swings again but gets an inside edge towards the keeper for one","  11.2    Henriques to Uthappa, 1 run, now he's early into a cut shot. Firstly, not the length, and then there's lack of pace. Uthappa expected a normal pace delivery, gets a slower one and chops an inside edge behind the wicket  "
2017,1082627,SRH v KKR,SRH,KKR,KKR,2,12,3,1,"Henriques to Pathan, 1 run",False,False,False,32498,Yusuf Pathan,1,1,5961,Moises Henriques,2.3,0,22,0,,,,,,,False,"ball angles in towards the stumps, he bunts it to leg for one","  11.3    Henriques to Y Pathan, 1 run, fullish delivery on off, with Pathan hanging back in the crease. No room for the bat-swing in front for Pathan, who just about manages to drag it through mid-wicket  "
2017,1082627,SRH v KKR,SRH,KKR,KKR,2,12,4,6,"Henriques to Uthappa, SIX runs",True,False,False,35582,Robin Uthappa,51,25,5961,Moises Henriques,2.4,0,28,0,,,,,,,False,"place the 12th man in the second tier, I say! Shortish ball, Uthappa was on the prowl well before the ball came to him and middled it to the leg side again. That's his <b>fifty</b> too","  11.4   Henriques to Uthappa, SIX, that's a half-baked bouncer. At half the pace it should have been, so the shortish length is all too easy to deal with. Uthappa clubs it over cow corner with utter disdain. Gets to his fifty, another one this season "
2017,1082627,SRH v KKR,SRH,KKR,KKR,2,12,5,1,"Henriques to Uthappa, 1 run",False,False,False,35582,Robin Uthappa,52,26,5961,Moises Henriques,2.5,0,29,0,,,,,,,False,"makes some room, it's fullish outside off and he drives it down to long off","  11.5    Henriques to Uthappa, 1 run, overcompensatory full ball driven to long-off  "
2017,1082627,SRH v KKR,SRH,KKR,KKR,2,12,6,2,"Henriques to Pathan, 2 runs",False,False,False,32498,Yusuf Pathan,3,2,5961,Moises Henriques,3.0,0,31,0,,,,,,,False,"straight delivery, straight drive from Yusuf and Warner hares to his left from long-on but the batsmen are quick enough to get two","  11.6    Henriques to Y Pathan, 2 runs, drives on the up through the other side of the wicket and gets a couple. Lacked the elegance of a straight drive, if ou ask me, given how he had slapped the drive away, but it was timed well. 103 off 48, can they?  "
2017,1082627,SRH v KKR,SRH,KKR,KKR,2,13,1,1,"Mohammed Siraj to Uthappa, 1 run",False,False,False,35582,Robin Uthappa,53,27,940973,Mohammed Siraj,2.1,0,13,1,,,,,,,False,"takes the pace off and pitches it well outside off, Uthappa likes it on leg, and he sends it towards sweeper cover","  12.1    Siraj to Uthappa, 1 run, short, wide slower ball, so this cut is only as good as a single to wide long-off  "
2017,1082627,SRH v KKR,SRH,KKR,KKR,2,13,2,1,"Mohammed Siraj to Pathan, 1 run",False,False,False,32498,Yusuf Pathan,4,3,940973,Mohammed Siraj,2.2,0,14,1,,,,,,,False,"loud appeal for lbw as Yusuf is struck in front of the stumps, but it hit his bat before the pad","  12.2    Siraj to Y Pathan, 1 run, umpire walks away with a smile, so must be very confident. Looked like an inside-edge on this. Yeah, the umpire's right. Hurried on, this full ball, trimming the inside edge as Pathan was hurried into his clip  "
2017,1082627,SRH v KKR,SRH,KKR,KKR,2,13,3,0,"Mohammed Siraj to Uthappa, OUT",False,False,False,35582,Robin Uthappa,53,28,940973,Mohammed Siraj,2.3,0,14,2,35582.0,Robin Uthappa,Mohammed Siraj,53.0,28.0,RV Uthappa c Warner b Mohammed Siraj 53 (55m 28b 4x4 4x6) SR: 189.28,False,"holes out to long off, Warner takes the catch, turns around to the crowd and punches the air with aggression! Siraj bowled it slow and well outside off, Uthappa went for the big shot and slapped it straight to the captain","  12.3    Siraj to Uthappa, out Caught by Warner!! Caught at long-off. This is a big wicket, make no mistake about that. And brought about by a man coming into the side today. Nicely done. Preempts the fact that Uthappa is going for his shots, bowls it short and wide - taking a leaf out from Bhuvi's last over - and has Uthappa toe-end the forehand slap kinda shot to Warner in the deep. Simplest of catches that; Siraj completely undid him with lack of pace. Uthappa c Warner b Siraj 53(28) [4s-4 6s-4]  "
2017,1082627,SRH v KKR,SRH,KKR,KKR,2,13,4,0,"Mohammed Siraj to Jackson, no run",False,False,False,237696,Sheldon Jackson,0,1,940973,Mohammed Siraj,2.4,0,14,2,,,,,,,False,"that's a nasty bouncer first ball, excellent delivery! He banged it in just outside off, came in a bit with the angle and Jackson was on his toes as the ball went past his head","  12.4    Siraj to Jackson, no run, god, look at that. Jackson is swaying away from that. Hits the deck like a man who's just got a wicket and hurries Jackson out of the line. Brilliant ball. Such a sight. Couldn't spot the miles it clocked but it was quick - trust me on that  "
2017,1082627,SRH v KKR,SRH,KKR,KKR,2,13,5,0,"Mohammed Siraj to Jackson, no run",False,False,False,237696,Sheldon Jackson,0,2,940973,Mohammed Siraj,2.5,0,14,2,,,,,,,False,follows it with a full delivery which is driven down to mid off,"  12.5    Siraj to Jackson, no run, now follows up with a yorker that Jackson just about manages to squeeze out. This lad is good. Keep an eye  "
2017,1082627,SRH v KKR,SRH,KKR,KKR,2,13,6,1,"Mohammed Siraj to Jackson, 1 run",False,False,False,237696,Sheldon Jackson,1,3,940973,Mohammed Siraj,3.0,0,15,2,,,,,,,False,"tries the yorker, thelow full toss is driven down to long on","  12.6    Siraj to Jackson, 1 run, a very deliberate low full toss that's been angl;ed from wide of the crease - Siraj is bowling from over the wicket here. Jackson waits and wrists it to long-on, playing just in time. 100 off 7 overs  "
2017,1082627,SRH v KKR,SRH,KKR,KKR,2,14,1,1,"Rashid Khan to Jackson, 1 run",False,False,False,237696,Sheldon Jackson,2,4,793463,Rashid Khan,2.1,0,23,0,,,,,,,False,"pretty flat on middle and leg, he miscues the pull a little to long on","  13.1    Rashid Khan to Jackson, 1 run, hurries onto him quickly, this dragged,down legbreak, and Jackson's pull is as good as long-on  "
2017,1082627,SRH v KKR,SRH,KKR,KKR,2,14,2,1,"Rashid Khan to Pathan, 1 run",False,False,False,32498,Yusuf Pathan,5,4,793463,Rashid Khan,2.2,0,24,0,,,,,,,False,"pretty full, drilled absolutely straight by Yusuf along the ground, Warner slides to his left from long on and pushes the ball to long off. Excellent effort","  13.2    Rashid Khan to Y Pathan, 1 run, Warner and Yuvraj have tag-teamed to stop this brutal straight drive, well if you can call it that. Takes his front leg out and smashes it along the ground. Warner is at wide long-on, slides and half-stops, when Yuvi joins in the fun and cleans up  "
2017,1082627,SRH v KKR,SRH,KKR,KKR,2,14,3,0,"Rashid Khan to Jackson, no run",False,False,False,237696,Sheldon Jackson,2,5,793463,Rashid Khan,2.3,0,24,0,,,,,,,False,"pretty tight line, Jackson is cramped and nudges it to leg","  13.3    Rashid Khan to Jackson, no run, a head-first dive from mid-wicket to attempt a run-out but Jackson clipped this and aborted the run in time. But very pictorial from the fielder there. Well done  "
2017,1082627,SRH v KKR,SRH,KKR,KKR,2,14,4,1,"Rashid Khan to Jackson, 1 run",False,False,False,237696,Sheldon Jackson,3,6,793463,Rashid Khan,2.4,0,25,0,,,,,,,False,"a bit too short, it's pulled to deep midwicket and they don't have time for the second","  13.4    Rashid Khan to Jackson, 1 run, he's bowling short and getting away. Perhaps playing with the pace. Pulled to long-on  "
2017,1082627,SRH v KKR,SRH,KKR,KKR,2,14,5,1,"Rashid Khan to Pathan, 1 run",False,False,False,32498,Yusuf Pathan,6,5,793463,Rashid Khan,2.5,0,26,0,,,,,,,False,"it's the googly, short enough for Yusuf to adjust to it and he pulls it away","  13.5    Rashid Khan to Y Pathan, 1 run, another short ball, another pull and Pathan is only half in control, for a pull against a spinner. Well, KKR need him tonight. We will see  "
2017,1082627,SRH v KKR,SRH,KKR,KKR,2,14,6,4,"Rashid Khan to Jackson, FOUR runs",True,False,False,237696,Sheldon Jackson,7,7,793463,Rashid Khan,3.0,0,30,0,,,,,,,False,"dances down, takes the ball on the full outside off and drives it with a full swing to slay it through the covers","  13.6    Rashid Khan to Jackson, FOUR, good shot. Looked pretty. Was bowled full and wide, Jackson had made the room early but inclines his weight across, pinned on his front foot, and smothers the drive through covers. 92 off 36  "
2017,1082627,SRH v KKR,SRH,KKR,KKR,2,15,1,0,"Kaul to Pathan, no run",False,False,False,32498,Yusuf Pathan,6,6,326017,Siddarth Kaul,2.1,0,15,1,,,,,,,False,"slower one at 122kph outside off, it was the <b>knuckle ball</b>, and Yusuf swing his arms but missed","  14.1    S Kaul to Y Pathan, no run, he's learning his trade gradually, is Kaul. Entices a pull shot with the length but bowls it slow. Like a cutter. Pathan is way early into the shot and then crouches to suggest that the ball stayed low. Well, it did Yusuf, because it was bowled slow  "
2017,1082627,SRH v KKR,SRH,KKR,KKR,2,15,2,2,"Kaul to Pathan, 2 runs",False,False,False,32498,Yusuf Pathan,8,7,326017,Siddarth Kaul,2.2,0,17,1,,,,,,,False,"pretty full now, he goes down on a knee and lofts it over the covers. Bhuvi cuts it off at the boundary and Yusuf dives back for the second","  14.2    S Kaul to Y Pathan, 2 runs, throws his arms across and slashes the ball over cover-point I think. Well, it's a couple over the infield on the off-side. Simple  "
2017,1082627,SRH v KKR,SRH,KKR,KKR,2,15,3,0,"Kaul to Pathan, no run",False,False,False,32498,Yusuf Pathan,8,8,326017,Siddarth Kaul,2.3,0,17,1,,,,,,,False,"chance of a run out, slightly inaccurate throw from Henriques. Yusuf slammed the ball to cover and Jackson was more than halfway down the pitch but Yusuf said no a few times, slightly wayward throw saved Jackson as he came back","  14.3    S Kaul to Y Pathan, no run, driven on the up through covers, where Moises stops it and attempts a direct-hit at the bowler's end. Jackson was halfway down and had Kaul not been in front, but back, there was a run-out chance there. Certainly  "
2017,1082627,SRH v KKR,SRH,KKR,KKR,2,15,4,0,"Kaul to Pathan, no run",False,False,False,32498,Yusuf Pathan,8,9,326017,Siddarth Kaul,2.4,0,17,1,,,,,,,False,nice and quick bouncer that Yusuf can't get on top of and misses,"  14.4   S Kaul to Y Pathan, no run, slower short ball, Pathan misses the pull. Hops and swats, can't connect "
2017,1082627,SRH v KKR,SRH,KKR,KKR,2,15,5,1,"Kaul to Pathan, 1 run",False,False,False,32498,Yusuf Pathan,9,10,326017,Siddarth Kaul,2.5,0,18,1,,,,,,,False,"slower one again, well outside off, he gets an inside edge to the leg side for one","  14.5    S Kaul to Y Pathan, 1 run, the feet don't move, the hands do - for a drive through covers. But look Pathan, look, it's been bowled slow and you have inside-edged it to square leg instead  "
2017,1082627,SRH v KKR,SRH,KKR,KKR,2,15,6,1,"Kaul to Jackson, 1 run",False,False,False,237696,Sheldon Jackson,8,8,326017,Siddarth Kaul,3.0,0,19,1,,,,,,,False,"141kph, swinging in a bit late, almost a yorker and he pushes it down to long off","  14.6    S Kaul to Jackson, 1 run, full ball, squeezed back down the ground for a single to long-off. 88 off 30. Gee, this looks gone  "
2017,1082627,SRH v KKR,SRH,KKR,KKR,2,16,1,0,"Rashid Khan to Jackson, no run",False,False,False,237696,Sheldon Jackson,8,9,793463,Rashid Khan,3.1,0,30,0,,,,,,,False,"appeal for caught behind as the full delivery outside off is misses by the batsman, it was the noise of bat hitting the ground","  15.1    Rashid Khan to Jackson, no run, there hasn't been a more farcical appeal. Full ball, very full ball, drifting away. Jackson is no way near to dig that out, but Naman Ojha appeals. For some reason  "
