season,match_id,match_name,home_team,away_team,current_innings,innings_id,over,ball,runs,shortText,isBoundary,isWide,isNoball,batsman1_id,batsman1_name,batsman1_runs,batsman1_balls,bowler1_id,bowler1_name,bowler1_overs,bowler1_maidens,bowler1_runs,bowler1_wkts,wicket_id,wkt_batsman_name,wkt_bowler_name,wkt_batsman_runs,wkt_batsman_balls,wkt_text,isRetiredHurt,comm_cricinfo,comm_cricbuzz
2017,1082627,SRH v KKR,SRH,KKR,SRH,1,19,1,1,"Woakes to Yuvraj Singh, 1 wide",False,True,False,36084,Yuvraj Singh,3,3,247235,Chris Woakes,3.0,0,31,1,,,,,,,False,a wide yorker from Woakes. Outside the tramline says the umpire. Wide,"  18.1    Woakes to Yuvraj, wide, how is that a wide? Poor call from the umpire. Low full toss wide outside off stump, Yuvraj fails to reach out  "
2017,1082627,SRH v KKR,SRH,KKR,SRH,1,19,1,1,"Woakes to Yuvraj Singh, 1 run",False,False,False,36084,Yuvraj Singh,4,4,247235,Chris Woakes,3.1,0,32,1,,,,,,,False,"a short slow delivery down leg, pulled away to deep backward square leg. Just the one more","  18.1    Woakes to Yuvraj, 1 run, slower delivery on the leg stump, Yuvraj pulls it to deep backward square leg  "
2017,1082627,SRH v KKR,SRH,KKR,SRH,1,19,2,0,"Woakes to Williamson, no run",False,False,False,277906,Kane Williamson,21,17,247235,Chris Woakes,3.2,0,32,1,,,,,,,False,"excellent bowling. Full and wide outside off, Williamson backs away and can't get bat on ball","  18.2    Woakes to Williamson, no run, well bowled by Woakes. Saw Williamson backing away and bowled it wide outside off stump, the New Zealander couldn't make contact  "
2017,1082627,SRH v KKR,SRH,KKR,SRH,1,19,3,4,"Woakes to Williamson, FOUR runs",True,False,False,277906,Kane Williamson,25,18,247235,Chris Woakes,3.3,0,36,1,,,,,,,False,"lovely shot. Full delivery on off, Williamson lofts the ball past mid-off. Straight bat face. Picked his spot again","  18.3    Woakes to Williamson, FOUR, that movement across the stumps was playing on the bowler's mind, he tried to bowl full and wide outside off stump again, Williamson stays put, lofts handsomely to the right of mid-off  "
2017,1082627,SRH v KKR,SRH,KKR,SRH,1,19,4,2,"Woakes to Williamson, 2 runs",False,False,False,277906,Kane Williamson,27,19,247235,Chris Woakes,3.4,0,38,1,,,,,,,False,"a great yorker on middle, worked away into the gap at deep square leg for two. Fantastic batting","  18.4    Woakes to Williamson, 2 runs, what a ball and well played. Inswinging yorker on the stumps, Williamson flicks it away into the on-side and he comes back two  "
2017,1082627,SRH v KKR,SRH,KKR,SRH,1,19,5,4,"Woakes to Williamson, FOUR runs",True,False,False,277906,Kane Williamson,31,20,247235,Chris Woakes,3.5,0,42,1,,,,,,,False,superb. Great batting. Was anticipating a yorker but it's a slower delivery outside off so he gets underneath the length and laps the ball over the keeper for four,"  18.5    Woakes to Williamson, FOUR, how did he manage to hit that so well. Good slower ball bouncer, Williamson got into an awkward position to scoop that, went through with that shot and it bounced inside the rope  "
2017,1082627,SRH v KKR,SRH,KKR,SRH,1,19,6,4,"Woakes to Williamson, FOUR runs",True,False,False,277906,Kane Williamson,35,21,247235,Chris Woakes,4.0,0,46,1,,,,,,,False,"does it again. Gets across outside off, gets the length he was waiting for in the previous delivery and just deflects the ball past short fine leg for four.","  18.6    Woakes to Williamson, FOUR, cheeky from Kane! Moved right across the stumps and paddled that, didn't middle it, got a bit of an edge, but that was good enough, short fine leg had no chance. 200 up for Hyderabad  "
2017,1082627,SRH v KKR,SRH,KKR,SRH,1,20,1,1,"Coulter-Nile to Yuvraj Singh, 1 run",False,False,False,36084,Yuvraj Singh,5,5,261354,Nathan Coulter-Nile,3.1,0,28,0,,,,,,,False,"another absolute sitter shelled. <b>Dropped</b>. How is this happening? A slow, short delivery down leg. Yuvraj sweeps but picks out deep square leg. Jackson gets across and lets down an absolute dolly.","  19.1    Coulter-Nile to Yuvraj, 1 run, dropped, easy chance. NCN almost killed the fielder with that stare. Sheldon Jackson it was. Shortish and on the leg stump, Yuvraj flicks in a whippy manner, Jackson ran to his left slightly and covered the distance nicely, looked like he'd easily catch it but it popped out  "
2017,1082627,SRH v KKR,SRH,KKR,SRH,1,20,2,2,"Coulter-Nile to Williamson, 2 runs",False,False,False,277906,Kane Williamson,37,22,261354,Nathan Coulter-Nile,3.2,0,30,0,,,,,,,False,"full and straight again, Yusuf gets across and stops the ball. But can't prevent a comfortable two","  19.2    Coulter-Nile to Williamson, 2 runs, fullish and on the off stump, Williamson glances it fine, Yusuf manages to stop the ball  "
2017,1082627,SRH v KKR,SRH,KKR,SRH,1,20,3,2,"Coulter-Nile to Williamson, 2 runs",False,False,False,277906,Kane Williamson,39,23,261354,Nathan Coulter-Nile,3.3,0,32,0,,,,,,,False,"another length delivery and straight, worked away to the other side of Yusuf. He stops it on the bounce. Two more.","  19.3    Coulter-Nile to Williamson, 2 runs, Yusuf kept busy again, this time Williamson flicks to his left, he got a good bounce to make his life easy. Williamson takes a moment to get his breath back  "
2017,1082627,SRH v KKR,SRH,KKR,SRH,1,20,4,0,"Coulter-Nile to Williamson, no run",False,False,False,277906,Kane Williamson,39,24,261354,Nathan Coulter-Nile,3.4,0,32,0,,,,,,,False,"136 kph, looking for the yorker. Williamson gets across and hits the ball back to the bowler. Good stop from Coulter-Nile","  19.4    Coulter-Nile to Williamson, no run, low full toss, hit back to the bowler, who does very well to stop the ball  "
2017,1082627,SRH v KKR,SRH,KKR,SRH,1,20,5,1,"Coulter-Nile to Williamson, 1 run",False,False,False,277906,Kane Williamson,40,25,261354,Nathan Coulter-Nile,3.5,0,33,0,,,,,,,False,"short delivery on middle, pulled to deep midwicket. Just one","  19.5   Coulter-Nile to Williamson, 1 run, slower short ball, Williamson mistimes the pull to deep mid-wicket "
2017,1082627,SRH v KKR,SRH,KKR,SRH,1,20,6,1,"Coulter-Nile to Yuvraj Singh, 1 run, OUT",False,False,False,36084,Yuvraj Singh,6,6,261354,Nathan Coulter-Nile,4.0,0,34,0,36084.0,Yuvraj Singh,Nathan Coulter-Nile,6.0,6.0,KS Williamson run out (Coulter-Nile/&dagger;Uthappa) 40 (39m 25b 5x4 0x6) SR: 160.00,False,"superb yorker, worked away to deep midwicket. Coulter-Nile gets across, gets to the ball, and returns the throw to the keeper. Should have been two there but Yuvraj selfishly sends Williamson back, who is run-out. Williamson isn't please Yuvraj didn't come back. That was not good running from Yuvraj, not a good innings from him, no intent at all.","  19.6   Coulter-Nile to Yuvraj, out Williamson Run Out!! 1 run completed. What was Yuvraj Singh doing there? Could have attempted the second run, instead puts his arm up, Kane was halfway down the pitch and had no chance. Didn't take the first run briskly and that is why Yuvi said no. Every run is important in this form of the game. Games are won and lost even by a margin of 1 run. Looked like he never was keen for the second. Yorker on the stumps, Yuvraj flicks into the vacant mid-wicket region, could have been two if he was a little quicker, the bowler had to run all the way to mid-wicket, he did well to fire an accurate throw to the keeper. Williamson run out (Coulter-Nile/Uthappa) 40(25) [4s-5] "
2017,1082627,SRH v KKR,SRH,KKR,KKR,2,1,1,0,"Kumar to Narine, no run",False,False,False,230558,Sunil Narine,0,1,326016,Bhuvneshwar Kumar,0.1,0,0,0,,,,,,,False,"pretty full and wide, almost in the block hole, Narine swings and misses","  0.1    Bhuvneshwar to Narine, no run, too full a ball outside off and Narine does not make much effort with his feet to reach that. Beaten  "
2017,1082627,SRH v KKR,SRH,KKR,KKR,2,1,2,1,"Kumar to Narine, 1 run",False,False,False,230558,Sunil Narine,1,2,326016,Bhuvneshwar Kumar,0.2,0,1,0,,,,,,,False,"full and wide again, Narine gets toe end of the bat this time for a single to third man","  0.2    Bhuvneshwar to Narine, 1 run, another fuller ball outside off. Squeezes off the outside edge to third man to get things going  "
2017,1082627,SRH v KKR,SRH,KKR,KKR,2,1,3,0,"Kumar to Gambhir, no run",False,False,False,28763,Gautam Gambhir,0,1,326016,Bhuvneshwar Kumar,0.3,0,1,0,,,,,,,False,"tries the yorker, it swings a bit late into Gambhir who digs it out to extra cover","  0.3    Bhuvneshwar to Gambhir, no run, and very full again. Gambhir thuds the drive into the ground towards cover  "
2017,1082627,SRH v KKR,SRH,KKR,KKR,2,1,4,4,"Kumar to Gambhir, FOUR runs",True,False,False,28763,Gautam Gambhir,4,2,326016,Bhuvneshwar Kumar,0.4,0,5,0,,,,,,,False,changes his length and concedes a boundary straightaway. It was just short of length towards the pads and Gambhir swatted it away along the ground past square leg,"  0.4    Bhuvneshwar to Gambhir, FOUR, ends up being a short on the legs of Gambhir, who whips it from there. Through square leg and into the fence. Not quite timed but fetches him a four  "
2017,1082627,SRH v KKR,SRH,KKR,KKR,2,1,5,0,"Kumar to Gambhir, no run",False,False,False,28763,Gautam Gambhir,4,3,326016,Bhuvneshwar Kumar,0.5,0,5,0,,,,,,,False,"opens up a bit this time, it's a length ball on off and Gambhir punches it to cover-point","  0.5    Bhuvneshwar to Gambhir, no run, back of a length and angling across Gambhir; uses the width and punches towards Yuvi at cover-point  "
2017,1082627,SRH v KKR,SRH,KKR,KKR,2,1,6,4,"Kumar to Gambhir, FOUR runs",True,False,False,28763,Gautam Gambhir,8,4,326016,Bhuvneshwar Kumar,1.0,0,9,0,,,,,,,False,"looking for the yorker again but it's a low full toss with a wee bit of room and Gambhir drives it down from the off stump, straight enough from the middle to beat mid off","  0.6    Bhuvneshwar to Gambhir, FOUR, low full toss and Gambhir cracks it past mid-off to bring his second four of the over. The idea from Bhuvneshwar was to bowl a yorker but could not control it there  "
2017,1082627,SRH v KKR,SRH,KKR,KKR,2,2,1,0,"Mohammed Siraj to Narine, no run",False,False,False,230558,Sunil Narine,1,3,940973,Mohammed Siraj,0.1,0,0,0,,,,,,,False,"angles it across from length, Narine swings through the line and misses it outside off","  1.1    Siraj to Narine, no run, pacy delivery, going across Narine. Tries to drive on the up and is beaten  "
2017,1082627,SRH v KKR,SRH,KKR,KKR,2,2,2,0,"Mohammed Siraj to Narine, OUT",False,False,False,230558,Sunil Narine,1,4,940973,Mohammed Siraj,0.2,0,0,1,230558.0,Sunil Narine,Mohammed Siraj,1.0,4.0,SP Narine c Warner b Mohammed Siraj 1 (5m 4b 0x4 0x6) SR: 25.00,False,"can't stay out of action, Warner takes the catch to send Narine back. Narine got his front foot out of the way early to make room, Siraj pitched it straight and Narine tried to loft it over the covers but didn't get enough and Warner ran back a little, facing the boundary, to get under it in time and catch with both hands","  1.2    Siraj to Narine, out Caught by Warner!! That will hurt. KKR needed Narine to fire, he does not. Makes room to this short ball and for some odd reason does not go full throttle with the cut. The ball might have held a bit on the pitch, mistimed to the right of Warner at extra cover. Good running catch from the centurion. Narine c Warner b Siraj 1(4)  "
2017,1082627,SRH v KKR,SRH,KKR,KKR,2,2,3,0,"Mohammed Siraj to Gambhir, no run",False,False,False,28763,Gautam Gambhir,8,5,940973,Mohammed Siraj,0.3,0,0,1,,,,,,,False,"angles it across at good pace, hardly any room, Gambhir tries to cut but misses. Wasn't too far from the bat","  1.3    Siraj to Gambhir, no run, too close and quick to be cutting. Gambhir gets beaten outside off  "
2017,1082627,SRH v KKR,SRH,KKR,KKR,2,2,4,2,"Mohammed Siraj to Gambhir, 2 runs",False,False,False,28763,Gautam Gambhir,10,6,940973,Mohammed Siraj,0.4,0,2,1,,,,,,,False,"short ball, there's a deep square leg but Gambhir has pulled it towards deep midwicket and gets two as Rashid runs to his right to cut it off","  1.4    Siraj to Gambhir, 2 runs, short ball. Gambhir is hurried on the pull, mistimed to the right of Rashid Khan, who runs from deep square leg and keeps things down to two  "
2017,1082627,SRH v KKR,SRH,KKR,KKR,2,2,5,0,"Mohammed Siraj to Gambhir, no run",False,False,False,28763,Gautam Gambhir,10,7,940973,Mohammed Siraj,0.5,0,2,1,,,,,,,False,"angling it across, good pace and hardly any room again, he tries to nudge and misses again","  1.5    Siraj to Gambhir, no run, Gambhir is once again rooted in the crease, tries to work the angle across him and run down to third man. Does not make the connection eventually  "
2017,1082627,SRH v KKR,SRH,KKR,KKR,2,2,6,1,"Mohammed Siraj to Gambhir, 1 run",False,False,False,28763,Gautam Gambhir,11,8,940973,Mohammed Siraj,1.0,0,3,1,,,,,,,False,goes a bit wider and Gambhir runs it down to third man this time,"  1.6    Siraj to Gambhir, 1 run, pushes hard off the back foot and edges it. But it is a fat one, taking it past backward point and to third man - all along the ground  "
2017,1082627,SRH v KKR,SRH,KKR,KKR,2,3,1,0,"Kaul to Gambhir, no run",False,False,False,28763,Gautam Gambhir,11,9,326017,Siddarth Kaul,0.1,0,0,0,,,,,,,False,"drives it uppishly, falls a few yards short of Warner at mid-off. It was pitched up, Gambhir got the middle but not straight enough","  2.1    S Kaul to Gambhir, no run, starts with a fuller length delivery and Gambhir goes for the cracking drive. Does not time though and is lucky to see it bounce before Warner at mid-off  "
2017,1082627,SRH v KKR,SRH,KKR,KKR,2,3,2,0,"Kaul to Gambhir, no run",False,False,False,28763,Gautam Gambhir,11,10,326017,Siddarth Kaul,0.2,0,0,0,,,,,,,False,"pretty straight and tight on off stump, Gambhir blocks it back with a straight bat","  2.2    S Kaul to Gambhir, no run, 135kph. Kaul shortened the length a bit and got close to Gambhir who is forced to quell it into the pitch  "
2017,1082627,SRH v KKR,SRH,KKR,KKR,2,3,3,0,"Kaul to Gambhir, OUT",False,False,False,28763,Gautam Gambhir,11,11,326017,Siddarth Kaul,0.3,0,0,1,28763.0,Gautam Gambhir,Siddarth Kaul,11.0,11.0,G Gambhir c Rashid Khan b Kaul 11 (11m 11b 2x4 0x6) SR: 100.00,False,"that's gone a long long way into the sky, three men come under and a teenager called Rashid Khan takes it easily before spreading his arms, the crowd erupts! Short of length delivery, Gambhir tried to swat-pull it and it went towards wide long-on, but well inside the ropes. Rashid went back, Bhuvi ran from mid-on and Dhawan from deep midwicket only for Rashid to pouch it. Wow, replays show it was the knuckle ball...","  2.3    S Kaul to Gambhir, out Caught by Rashid Khan!! And with that KKR's hopes suffer another dent. Good judgement there from the SRH fielders. This mistimed pull from Gambhir went high in the air towards mid-wicket. There were at least three fielders in the vicinity, but they communicated well among themselves and it was the Afghan spinner who called for it, eventually taking it reverse-cupped. Gambhir c Rashid Khan b S Kaul 11(11) [4s-2]  "
2017,1082627,SRH v KKR,SRH,KKR,KKR,2,3,4,0,"Kaul to Uthappa, no run",False,False,False,35582,Robin Uthappa,0,1,326017,Siddarth Kaul,0.4,0,0,1,,,,,,,False,"angles it down the leg side, could have been a wide but flicks the pad","  2.4   S Kaul to Uthappa, no run, the Uthappa we are used to seeing, gets across too early and is in danger of getting trapped. Only that the ball is sliding down and he misses the flick "
2017,1082627,SRH v KKR,SRH,KKR,KKR,2,3,5,0,"Kaul to Uthappa, no run",False,False,False,35582,Robin Uthappa,0,2,326017,Siddarth Kaul,0.5,0,0,1,,,,,,,False,"better line - angling into Uthappa around middle and leg, pushed down to mid-on now","  2.5    S Kaul to Uthappa, no run, pushed from the crease to the fielder at mid-on  "
2017,1082627,SRH v KKR,SRH,KKR,KKR,2,3,6,4,"Kaul to Uthappa, FOUR runs",True,False,False,35582,Robin Uthappa,4,3,326017,Siddarth Kaul,1.0,0,4,1,,,,,,,False,"angling in again, might have expected it and swats it away between mid-on and midwicket to get off the mark","  2.6   S Kaul to Uthappa, FOUR, bit cross-batted but as long as they fetch runs. Got across to this length delivery and whipped between the man at mid-on and mid-wicket. Bhuvi with a chase there but soon realised it was only going to be a futile one. Kaul didn't like it one bit. Has a few words to say to which Robbie responds "
2017,1082627,SRH v KKR,SRH,KKR,KKR,2,4,1,0,"Mohammed Siraj to Pandey, no run",False,False,False,290630,Manish Pandey,0,1,940973,Mohammed Siraj,1.1,0,3,1,,,,,,,False,"138kph, no movement and outside off, quick enough as Pandey cuts and misses","  3.1    Siraj to M Pandey, no run, tentative from Manish. Tries to push away from the body to this length ball, is beaten  "
2017,1082627,SRH v KKR,SRH,KKR,KKR,2,4,2,1,"Mohammed Siraj to Pandey, 1 run",False,False,False,290630,Manish Pandey,1,2,940973,Mohammed Siraj,1.2,0,4,1,,,,,,,False,"some room this time and Pandey cuts it successfully, to third man for one","  3.2    Siraj to M Pandey, 1 run, finally decides to take his front foot towards the line of the ball, and then dabs towards third man  "
2017,1082627,SRH v KKR,SRH,KKR,KKR,2,4,3,0,"Mohammed Siraj to Uthappa, no run",False,False,False,35582,Robin Uthappa,4,4,940973,Mohammed Siraj,1.3,0,4,1,,,,,,,False,leans into the ball a little and defends into the off side,"  3.3    Siraj to Uthappa, no run, presses forward and pushes towards the fielder at short cover  "
2017,1082627,SRH v KKR,SRH,KKR,KKR,2,4,4,4,"Mohammed Siraj to Uthappa, FOUR runs",True,False,False,35582,Robin Uthappa,8,5,940973,Mohammed Siraj,1.4,0,8,1,,,,,,,False,"it's not full, but it has enough room and Uthappa swings his arms with some power to send that crashing through the covers along the ground","  3.4    Siraj to Uthappa, FOUR, that is a sonorous sound off the bat, not for the bowler of course. Is not that full around off, but Uthappa trusts the pace and drives on the up, past cover and into the fence in no time  "
2017,1082627,SRH v KKR,SRH,KKR,KKR,2,4,5,4,"Mohammed Siraj to Uthappa, FOUR runs",True,False,False,35582,Robin Uthappa,12,6,940973,Mohammed Siraj,1.5,0,12,1,,,,,,,False,"delicate stuff, nicely done for four! Pitched it well outside off, Uthappa didn't move much, waited for the ball and nudged it late enough to beat the wide slip and early enough to avoid the keeper","  3.5    Siraj to Uthappa, FOUR, he's played the field there. So aware of the men around him. The slip is wide and the third man is not covering for him. Uses the pace and opens the face of the bat to bisect the keeper and Williamson  "
2017,1082627,SRH v KKR,SRH,KKR,KKR,2,4,6,0,"Mohammed Siraj to Uthappa, no run",False,False,False,35582,Robin Uthappa,12,7,940973,Mohammed Siraj,2.0,0,12,1,,,,,,,False,"just a bit of room, Uthappa finds Yuvraj at point with a cut","  3.6    Siraj to Uthappa, no run, stays in the crease and pushes this length ball towards point. Looked in two minds there for a moment did Uthappa  "
2017,1082627,SRH v KKR,SRH,KKR,KKR,2,5,1,0,"Kaul to Pandey, no run",False,False,False,290630,Manish Pandey,1,3,326017,Siddarth Kaul,1.1,0,4,1,,,,,,,False,"he makes room, Kaul angles it in even more and Pandey is struck on the pad outside leg for a dot","  4.1    S Kaul to M Pandey, no run, he has not had a look at things and Pandey is trying to go across the line. Is justified a bit as he is trying to use the inward angle. Does not fetch much though and is rapped on the leg  "
2017,1082627,SRH v KKR,SRH,KKR,KKR,2,5,2,4,"Kaul to Pandey, FOUR runs",True,False,False,290630,Manish Pandey,5,4,326017,Siddarth Kaul,1.2,0,8,1,,,,,,,False,"opens up again, this time he takes it on the full and drills it straight down just past Uthappa to beat mid-on for four. Not sure he got the middle, but he got enough","  4.2    S Kaul to M Pandey, FOUR, and that is what you get for keeping the bat straight. Uncomplicated stuff, hits the on-drive to this length ball on the up and leaves mid-on redundant  "
2017,1082627,SRH v KKR,SRH,KKR,KKR,2,5,3,1,"Kaul to Pandey, 1 run",False,False,False,290630,Manish Pandey,6,5,326017,Siddarth Kaul,1.3,0,9,1,,,,,,,False,"better length to angle it in, Pandey defends towards off and gets the nod for a quick single","  4.3    S Kaul to M Pandey, 1 run, the trigger movement is on the front foot fro Pandey but the length is not quite there; waits and taps into the off-side for a single  "
2017,1082627,SRH v KKR,SRH,KKR,KKR,2,5,4,1,"Kaul to Uthappa, 1 run",False,False,False,35582,Robin Uthappa,13,8,326017,Siddarth Kaul,1.4,0,10,1,,,,,,,False,"hint of away movement outside off from length, Uthappa defends carefully towards cover point for one more","  4.4    S Kaul to Uthappa, 1 run, now Uthappa does what his partner just did. Waits a bit and then drops with soft hands in front of point  "
2017,1082627,SRH v KKR,SRH,KKR,KKR,2,5,5,4,"Kaul to Pandey, FOUR runs",True,False,False,290630,Manish Pandey,10,6,326017,Siddarth Kaul,1.5,0,14,1,,,,,,,False,too full and he's smashed that in the air just over Kaul's shoulder. Right on the middle stump and Pandey crashed it back before Kaul could react and he beat long-on too,"  4.5    S Kaul to M Pandey, FOUR, majestic! Half-volley this time but Pandey knew where the field was, hit the straight drive in the air but past the bowler. Is so straight that long-on does not stand a chance to his right  "
2017,1082627,SRH v KKR,SRH,KKR,KKR,2,5,6,1,"Kaul to Pandey, 1 run",False,False,False,290630,Manish Pandey,11,7,326017,Siddarth Kaul,2.0,0,15,1,,,,,,,False,"call for a quick single, Pandey runs hard and Rashid has a shy at bowler's end and <strong>misses</strong>. Pandey nudged the slower delivery to the leg side and took off immediately, Rashid sprang in too but needed a direct hit","  4.6    S Kaul to M Pandey, 1 run, would have been in some trouble there but makes it eventually. Pandey worked in front of mid-wicket and took on the fielder. Did not realise the pace on the shot and would have been struggling had there been a direct hit the bowler's end  "
2017,1082627,SRH v KKR,SRH,KKR,KKR,2,6,1,0,"Henriques to Pandey, no run",False,False,False,290630,Manish Pandey,11,8,5961,Moises Henriques,0.1,0,0,0,,,,,,,False,"he tries to work the ball to leg, but it has some bounce and takes his pad","  5.1    Henriques to M Pandey, no run, cuts a bit off the deck and comes into Pandey, who wants to tuck around the corner. Wears on the thigh pad and the ball rolls away  "
2017,1082627,SRH v KKR,SRH,KKR,KKR,2,6,2,1,"Henriques to Pandey, 1 run",False,False,False,290630,Manish Pandey,12,9,5961,Moises Henriques,0.2,0,1,0,,,,,,,False,"goes back and across for a big swing, it's a slow offcutter well outside off and he's cramped for room. Can only push it down to mid on for another quick single","  5.2    Henriques to M Pandey, 1 run, Pandey goes back and across in the crease, was definitely eyeing something big. But Henriques reduces the pace and foils the plan, pushed towards mid-on for a single  "
2017,1082627,SRH v KKR,SRH,KKR,KKR,2,6,3,1,"Henriques to Uthappa, 1 run",False,False,False,35582,Robin Uthappa,14,9,5961,Moises Henriques,0.3,0,2,0,,,,,,,False,"angling into Uthappa, he helps it along to short fine leg for one","  5.3    Henriques to Uthappa, 1 run, this is too risky from Uthappa. He is trying to play the field and gets too across, is lucky to have got some bat there. Intercepted at short fine leg  "
2017,1082627,SRH v KKR,SRH,KKR,KKR,2,6,4,1,"Henriques to Pandey, 1 run",False,False,False,290630,Manish Pandey,13,10,5961,Moises Henriques,0.4,0,3,0,,,,,,,False,"132kph, short of length with bounce again, he dabs the ball to midwicket","  5.4    Henriques to M Pandey, 1 run, Pandey is itching to force the issue. Once again shows his cards too early and tries to make room. Is followed by a shortish ball and can only tap it into the on-side  "
2017,1082627,SRH v KKR,SRH,KKR,KKR,2,6,5,1,"Henriques to Uthappa, 1 run",False,False,False,35582,Robin Uthappa,15,10,5961,Moises Henriques,0.5,0,4,0,,,,,,,False,"slow offcutter at 115kph, but it's a touch too short and Uthappa swats it to deep midwicket","  5.5    Henriques to Uthappa, 1 run, cross-batted desperate heave from Uthappa that has been propelled by a mounting required run-rate. There is a man at deep square and he keeps that to one  "
2017,1082627,SRH v KKR,SRH,KKR,KKR,2,6,6,4,"Henriques to Pandey, FOUR runs",True,False,False,290630,Manish Pandey,17,11,5961,Moises Henriques,1.0,0,8,0,,,,,,,False,"another cutter to end the over, Pandey is alert and opens up to push it past mid-on with a cross bat and even beats wide long-on for four","  5.6    Henriques to M Pandey, FOUR, not sure how well that was timed but it manages to beat Warner to the fence. Pandey once again backed away in the crease and to his liking got a shortish ball. A cross-batted whip beat the man at mid-on first, before Warner gave up running across from deep mid-wicket  "
2017,1082627,SRH v KKR,SRH,KKR,KKR,2,7,1,6,"Rashid Khan to Uthappa, SIX runs",True,False,False,35582,Robin Uthappa,21,11,793463,Rashid Khan,0.1,0,6,0,,,,,,,False,"that's some way to welcome Rashid, slog swept for a massive, massive six! Went down on a knee and dispatched that over deep midwicket for over 100 metres","  6.1    Rashid Khan to Uthappa, SIX, if one shot could be included in the wikipedia page of 'power', this is it. 101 metres from Uthappa. Slogs across the line and puts a lot of flesh on it to send it over the deep mid-wicket fence. Was hit with the turn, yes a googly it was  "
2017,1082627,SRH v KKR,SRH,KKR,KKR,2,7,2,0,"Rashid Khan to Uthappa, no run",False,False,False,35582,Robin Uthappa,21,12,793463,Rashid Khan,0.2,0,6,0,,,,,,,False,"tries to repeat the shot even the ball is a touch outside off, but misses the sweep completely","  6.2   Rashid Khan to Uthappa, no run, tries to replicate. The tossed up delivery goes away and beats his bat "
